Miklos Zrinyi (Count Nicholas Serini);1600;Hungarian statesman, military leader and poet;['mw121895.jpg'];Sitter associated with 1 portrait
Thomas Wadsworth;1600;Nonconformist minister and religious writer;['mw137508.jpg'];Sitter in 1 portrait
Cornelius de Wael;1600;Engraver;['mw66244.jpg', 'mw43058.jpg', 'layout.jpg'];Sitter in 3 portraits
Lucas de Wael;1600;History and landscape painter;['mw66244.jpg', 'mw43058.jpg', 'layout.jpg'];Sitter in 3 portraits
Baron John Wainwright;1600;Baron of the exchequer in Ireland;['mw197226.jpg'];Sitter in 1 portrait
Francis Quarles;1600;Poet;['mw200836.jpg', 'mw208188.jpg', 'mw132933.jpg', 'mw208222.jpg', 'mw132939.jpg', 'mw208237.jpg', 'mw208225.jpg'];Sitter associated with 7 portraits
William Wake;1600;Archbishop of Canterbury;['mw41506.jpg', 'mw41505.jpg', 'mw41507.jpg', 'mw79674.jpg', 'mw38887.jpg', 'mw143652.jpg', 'mw197303.jpg', 'mw06538.jpg'];Later Stuart Portraits Catalogue Entry
William Talbot;1600;Bishop of Durham;['mw66634.jpg', 'mw204413.jpg', 'mw38638.jpg', 'mw204550.jpg', 'layout.jpg'];Sitter in 5 portraits
Camille d'Hostun, Comte de Tallard;1600;Marshal of France;['layout.jpg'];Sitter in 1 portrait
Sébastien Vaillant;1600;French botanist;['mw198468.jpg', 'mw149706.jpg'];Sitter in 2 portraits
William Douglas, 1st Duke of Queensberry;1600;Politician, Lord High Commissioner of Scotland;['mw136688.jpg'];Sitter in 1 portrait
James Douglas, 2nd Duke of Queensberry;1600;Lord Privy Seal;['mw35378.jpg'];Sitter in 1 portrait
Robert Paston, 1st Earl of Yarmouth;1600;Politician and scientist;['mw114351.jpg', 'mw194260.jpg'];Sitter in 2 portraits
Charles Beauclerk, 1st Duke of St Albans;1600;Soldier;['mw191940.jpg', 'mw191946.jpg', 'mw90943.jpg', 'mw191945.jpg', 'mw136968.jpg', 'mw90945.jpg', 'mw68438.jpg'];Sitter in 7 portraits
Sir George Wakeman, Bt;1600;Royal physician;['mw123475.jpg', 'mw123415.jpg'];Sitter associated with 2 portraits
William Talman;1600;Architect;['mw08478.jpg'];Later Stuart Portraits Catalogue Entry
Pieter (or Peeter) van Avont;1600;Painter, draughtsman and printmaker;['mw43121.jpg'];Sitter in 1 portrait. Artist associated with 1 portrait
Pope Urban VIII (Maffeo Barbarini);1600;Pope 1623-1644;['mw129458.jpg', 'mw129460.jpg', 'mw129448.jpg', 'mw129450.jpg', 'mw129456.jpg', 'mw129446.jpg', 'mw129454.jpg', 'mw129457.jpg', 'mw129459.jpg', 'mw129461.jpg', 'mw129451.jpg', 'mw129452.jpg'];Sitter in 12 portraits
Sir Thomas Urquhart (Urchard);1600;Author and translator;['mw133221.jpg', 'mw133238.jpg'];Sitter in 2 portraits
John Urry;1600;Literary editor;['mw143339.jpg'];Sitter in 1 portrait
Forde Grey, Earl of Tankerville;1600;Lord Grey of Warke, Whig politician, First Lord of Treasury;['mw77548.jpg'];Sitter in 1 portrait
Jan van Belcamp;1600;Painter;['mw134197.jpg', 'mw134205.jpg'];Sitter in 2 portraits
Sir John Vanbrugh;1600;Architect and dramatist;['mw06471.jpg', 'mw06470.jpg', 'mw143441.jpg', 'mw143442.jpg', 'mw141739.jpg', 'mw41482.jpg', 'mw59625.jpg', 'mw68330.jpg', 'layout.jpg', 'mw37126.jpg'];Later Stuart Portraits Catalogue Entry
Titus Oates;1600;Informer;['mw80075.jpg', 'mw140268.jpg', 'mw65814.jpg', 'mw140269.jpg', 'mw37987.jpg', 'mw80074.jpg', 'mw40148.jpg', 'mw80006.jpg', 'mw141260.jpg', 'mw123449.jpg', 'mw123853.jpg', 'mw80078.jpg', 'mw123451.jpg', 'mw04723.jpg', 'mw123423.jpg', 'mw140267.jpg', 'mw80004.jpg', 'mw123442.jpg', 'mw123738.jpg', 'mw79950.jpg'];Sitter in 23 portraits. Oates was an opportunist who failed to make a career in the clergy. He made an insincere conversion to Catholicism and was briefly admitted into a Jesuit college. His experience there was used to give a veneer of plausibility to his fabricated Popish Plot to kill the king. His accusations caused panic in England and led to the persecution of Roman Catholics and the deaths of thirty-five innocent men. When the truth emerged, he was prosecuted for perjury and sentenced to be flogged, pilloried and imprisoned.
James Ussher;1600;Archbishop of Armagh;['mw143169.jpg', 'mw131207.jpg', 'mw131231.jpg', 'mw142839.jpg', 'mw143171.jpg', 'mw131214.jpg', 'mw142833.jpg', 'mw131206.jpg', 'mw131216.jpg', 'mw81965.jpg', 'mw131208.jpg', 'mw06458.jpg', 'mw142825.jpg', 'mw131220.jpg', 'mw143176.jpg', 'mw131211.jpg', 'mw143174.jpg', 'mw142821.jpg', 'mw143194.jpg', 'mw142836.jpg'];Sitter associated with 44 portraits
Frans van den Wyngaerde (Wijngaerde);1600;Draughtsman and publisher;['mw43543.jpg'];Sitter in 1 portrait. Artist associated with 6 portraits
Peter Vanderbank (Vandrebanc);1600;Engraver;['mw41484.jpg', 'mw41483.jpg'];Sitter in 2 portraits. Artist associated with 76 portraits. Peter Vanderbank moved to London in 1674. The first two plates that he made in England, two heads of Charles II, were considered by far the finest seen in the country up to that date, and established both Vanderbanks's reputation and his financial independence. Vanderbank initially published his own plates, but later worked mostly for other publishers and booksellers. He was no relation of the portrait painter John Vanderbank.
Hendrick van der Borcht the Elder;1600;Painter, engraver, dealer and collector;['mw134203.jpg', 'mw66258.jpg'];Sitter in 2 portraits. Artist associated with 2 portraits
Hendrick van der Borcht the Younger;1600;Artist;['mw43160.jpg', 'mw134151.jpg'];Sitter in 2 portraits. Artist associated with 4 portraits
John Yonge;1600;Irish Jesuit;['mw137665.jpg', 'mw137649.jpg'];Sitter in 2 portraits
Sir Edward Walker;1600;Secretary to Charles I;['mw137814.jpg', 'mw129638.jpg', 'mw129640.jpg', 'mw133091.jpg', 'mw01226.jpg'];Sitter in 5 portraits
Adriaen van der Venne;1600;Painter, draughtsman (designer for prints) and writer;['mw43513.jpg'];Sitter in 1 portrait
William van de Velde the Elder;1600;Marine painter;['mw139234.jpg', 'mw139262.jpg'];Sitter in 2 portraits
William van de Velde the Younger;1600;Marine painter;['mw139262.jpg', 'mw139267.jpg', 'mw59532.jpg', 'mw38857.jpg', 'layout.jpg'];Sitter in 5 portraits
Sir Anthony van Dyck;1600;Painter;['mw256899.jpg', 'mw134109.jpg', 'mw199397.jpg', 'mw134079.jpg', 'mw134078.jpg', 'mw134049.jpg', 'mw38854.jpg', 'mw134075.jpg', 'mw256909.jpg', 'mw81613.jpg', 'mw134104.jpg', 'mw89793.jpg', 'mw134080.jpg', 'mw245199.jpg', 'mw134091.jpg', 'mw138801.jpg', 'mw90745.jpg', 'mw134077.jpg', 'mw134100.jpg', 'mw76321.jpg'];Sitter associated with 30 portraits. Artist associated with 1023 portraits. Sir Anthony van Dyck was by far the most influential painter to have worked in Britain during the seventeenth century. Flemish by birth, he found patronage in a number of European countries, but his longest stay was in England, which he made his home from the beginning of his second visit in 1632 until his death in 1641 (with a break back in Antwerp in 1634-5). While his predecessors from the Low Countries had brought to Britain hints of what painting might become, it was van Dyck who decisively turned British portraiture away from the stiff, formal 'iconic' approach of Tudor and Jacobean painting. In England he developed the distinctive fluid, shimmering style that was to dominate portraiture in Britain not just during the seventeenth century but right up until the early years of the twentieth century. Rewarded by his most famous patron, Charles I, with a knighthood, his enduring influence - and a sense that it would be impossible to better him - was universally recognised and remarked on not only by his contemporaries but also by his successors.. . More on van Dyck: In focus: Anthony van Dyck | Van Dyck A Masterpiece for everyone. Watch a film clip on the artist from the BBC Archive in the Media section below
Sir Henry Vane the Elder;1600;Secretary of State;['mw131620.jpg', 'mw131622.jpg', 'mw129736.jpg', 'mw06477.jpg'];Sitter in 4 portraits
Sir Henry Vane the Younger;1600;Revolutionary;['mw38864.jpg', 'mw06478.jpg', 'mw137413.jpg', 'mw131642.jpg', 'layout.jpg', 'mw131641.jpg', 'mw149383.jpg', 'mw131680.jpg', 'mw131643.jpg', 'mw131635.jpg', 'mw129736.jpg', 'mw122709.jpg', 'mw122711.jpg', 'mw131623.jpg'];Sitter associated with 14 portraits
Thomas van Erpe (known as Thomas Erpenius);1600;Dutch Orientalist;['mw129535.jpg', 'mw129533.jpg'];Sitter in 2 portraits
John Radcliffe;1600;Physician;['mw142149.jpg', 'mw78365.jpg', 'mw142146.jpg', 'layout.jpg', 'mw142147.jpg', 'mw05190.jpg', 'mw75662.jpg', 'mw76393.jpg', 'mw142141.jpg'];Sitter associated with 9 portraits
Antonie van Leeuwenhoek;1600;Dutch tradesman and scientist, known as 'the Father of Microbiology';['mw140568.jpg', 'mw140569.jpg'];Sitter in 2 portraits
Robert Walker;1600;Painter;['mw136240.jpg', 'mw136252.jpg', 'mw06550.jpg'];Sitter in 3 portraits. Artist associated with 143 portraits. Walker was a prolific portrait painter, chiefly patronised by Parliamentarians, among them Cromwell, Ireton and Fairfax. He often used poses derived from van Dyck's portraits, but he had a distinct, soft style of his own.
Thomas Walker;1600;Headmaster of Charterhouse School;['mw38913.jpg', 'mw197433.jpg', 'mw143923.jpg', 'mw38914.jpg'];Sitter in 4 portraits
John Robartes, 1st Earl of Radnor;1600;Politician and army officer;['mw136600.jpg', 'mw132224.jpg', 'mw132225.jpg'];Sitter in 3 portraits
Rembrandt Harmensz van Rijn;1600;Artist;['mw119825.jpg', 'layout.jpg', 'mw139170.jpg', 'mw119636.jpg', 'mw139190.jpg', 'mw119992.jpg', 'mw130170.jpg', 'mw139189.jpg'];Sitter in 8 portraits. Artist associated with 12 portraits. . . Watch a film clip on the artist from the BBC Archive in the Media section below
Anna Maria van Schurman;1600;Poet and scholar;['mw134547.jpg', 'mw134542.jpg', 'mw253346.jpg', 'mw134549.jpg', 'mw134535.jpg', 'mw253347.jpg', 'mw253348.jpg'];Sitter in 7 portraits. Artist of 1 portrait. Anna Maria van Schurman had become an honorary member of the Utrecht artists' guild in 1643, but was principally known for her intellectual achievements. The first woman to study at a Dutch university, she was famous for her knowledge of languages, history, poetry, the liberal arts, philosophy, medicine and theology, and for her piety.
Adriaen van Stalbemt;1600;Painter;['mw134172.jpg', 'mw134176.jpg', 'mw134174.jpg', 'mw134175.jpg'];Sitter in 4 portraits
Cornelis van Tromp;1600;Lieutenant-Admiral;['mw59315.jpg', 'mw140536.jpg', 'mw140556.jpg', 'mw140552.jpg', 'mw140528.jpg'];Sitter associated with 5 portraits. Dutch admiral and second son of the Admiral Martin Van Tromp. He visited England in 1675 when he was created a baronet by Charles II.
William Cecil, 2nd Earl of Salisbury;1600;Politician and Lord Lieutenant of Hertfordshire and Dorset;['mw133975.jpg', 'mw82394.jpg', 'mw82390.jpg', 'mw82389.jpg', 'mw133977.jpg', 'mw82391.jpg', 'layout.jpg'];Sitter in 7 portraits
Frances Cecil (née Bennett), Countess of Salisbury;1600;Wife of 4th Earl of Salisbury;['mw60081.jpg', 'mw142424.jpg', 'layout.jpg', 'mw142423.jpg', 'mw203746.jpg', 'mw203747.jpg', 'mw142425.jpg', 'mw38401.jpg'];Sitter in 8 portraits
William Walker;1600;Schoolmaster and author;['mw137265.jpg', 'mw137264.jpg', 'mw128887.jpg'];Sitter in 3 portraits
Jan van Wyck;1600;Painter;['mw139255.jpg', 'mw195142.jpg', 'mw39257.jpg'];Sitter in 3 portraits. Artist associated with 8 portraits
William Salmon;1600;Empiric and writer;['mw138381.jpg', 'mw138377.jpg', 'mw138382.jpg', 'mw90916.jpg', 'mw90922.jpg', 'mw90923.jpg', 'mw90918.jpg', 'mw90920.jpg', 'mw138379.jpg', 'mw138380.jpg', 'mw90914.jpg'];Sitter in 11 portraits
Jeremy Taylor;1600;Bishop of Down and Connor;['mw91139.jpg', 'mw91135.jpg', 'mw91132.jpg', 'mw91131.jpg', 'mw137115.jpg', 'mw91144.jpg', 'mw70371.jpg', 'mw205179.jpg', 'mw137098.jpg', 'mw137116.jpg', 'mw205177.jpg', 'mw135509.jpg', 'mw137113.jpg', 'mw135502.jpg', 'mw135512.jpg', 'mw137111.jpg', 'mw91138.jpg', 'mw91134.jpg', 'mw135511.jpg', 'mw91143.jpg'];Sitter in 30 portraits
John Taylor;1600;Writer known as 'The Water Poet';['mw133471.jpg', 'mw133472.jpg', 'mw212700.jpg', 'mw81136.jpg', 'mw133475.jpg', 'mw42270.jpg', 'mw133470.jpg'];Sitter in 7 portraits
John Taylor;1600;Brother of Brook Taylor;['layout.jpg', 'mw08092.jpg'];Sitter in 2 portraits
John Ogilby;1600;Publisher and geographer;['mw138627.jpg', 'mw39759.jpg', 'mw138635.jpg', 'mw138624.jpg', 'mw39758.jpg', 'mw79145.jpg', 'mw15578.jpg', 'mw138628.jpg'];Sitter in 8 portraits
Sir John Oglander;1600;Diarist;['layout.jpg', 'mw114391.jpg'];Sitter in 2 portraits
John Nash;1600;Alderman of Worcester;['mw135920.jpg'];Sitter in 1 portrait
Albrecht Wallenstein, Duke of Friedland;1600;Austrian soldier;['mw42348.jpg'];Sitter in 1 portrait
Edmund Waller;1600;Poet;['mw138578.jpg', 'mw90862.jpg', 'mw138577.jpg', 'mw197528.jpg', 'mw138580.jpg', 'mw67621.jpg', 'mw132834.jpg', 'mw132830.jpg', 'mw138582.jpg', 'mw06554.jpg', 'mw138583.jpg', 'mw138581.jpg', 'mw138584.jpg', 'mw129736.jpg', 'mw06555.jpg', 'mw138585.jpg', 'mw138586.jpg'];"Sitter in 17 portraits. Poet and wit of wavering political allegiance; in the Civil War, first supported Parliament and then led a plot ('Waller Plot') to seize London for Charles I; was sentenced to death, but the sentence was connuted to a fine of £10,000 and exile, 1644; was pardoned by Cromwell's influence; praised Cromwell in verse, but later rejoiced in his death; published Upon His Majesty's Happy Return at the Restoration and was a favourite at court; 'Sacharissa' was the mistress of his youthful poems; his most famous lyric is 'Go, lovely rose.'"
Sir William Waller;1600;Parliamentary general;['mw267252.jpg', 'mw205457.jpg', 'mw132184.jpg', 'mw132188.jpg', 'mw205459.jpg', 'mw132187.jpg', 'mw205461.jpg', 'mw132189.jpg', 'mw205458.jpg', 'mw205456.jpg', 'mw06556.jpg', 'mw132185.jpg', 'mw06557.jpg', 'mw41517.jpg', 'mw129736.jpg', 'mw123407.jpg', 'mw08007.jpg'];Sitter associated with 17 portraits. Waller, a zealous Puritan, opposed the Crown in the Long Parliament and during the Civil War held a chief command in the West Country until 1645. At the end of the interregnum he was imprisoned for three years and after his release lived for a time in poverty before turning his support towards the restoration of the monarchy.
Edward Rainbow (Rainbowe);1600;Bishop of Carlisle;['mw137042.jpg', 'mw137038.jpg'];Sitter in 2 portraits
Sir Richard Rainsford;1600;Judge;['mw38245.jpg', 'mw137906.jpg', 'mw137905.jpg', 'layout.jpg', 'mw05202.jpg', 'mw38246.jpg'];Sitter in 6 portraits
François de la Mothe le Vayer;1600;French author;['layout.jpg'];Sitter in 1 portrait
Louis Laguerre;1600;Painter;['layout.jpg'];Sitter in 1 portrait. Artist associated with 6 portraits
Sir John Ogle;1600;Army officer;['mw120838.jpg', 'mw120840.jpg', 'mw127329.jpg'];Sitter in 3 portraits
Ernst Casimir, Count of Nassau;1600;Field marshal and Stadtholder of Friesland;['mw129444.jpg'];Sitter in 1 portrait
John Wallis;1600;Mathematician;['mw41518.jpg', 'mw137238.jpg', 'mw06558.jpg', 'mw137223.jpg', 'mw122916.jpg', 'mw06559.jpg', 'mw122918.jpg', 'mw78363.jpg', 'mw137239.jpg', 'mw197545.jpg', 'mw197546.jpg'];Later Stuart Portraits Catalogue Entry
Dorothy (née Coventry), Lady Pakington;1600;Writer, reputed author of 'The Whole Duty of Man';['mw15701.jpg', 'mw139818.jpg', 'mw15705.jpg'];Sitter in 3 portraits
Walter Ralegh;1600;Eldest son of Sir Walter Ralegh;['mw05205.jpg'];Sitter in 1 portrait. . . More on Walter Ralegh: Tudor & Jacobean Portraits book in our Shops
Nathaniel Taylor;1600;Brother of Brook Taylor;['mw08092.jpg'];Sitter in 1 portrait
Thomas Taylor;1600;Puritan divine;['mw114918.jpg', 'mw131348.jpg', 'mw119043.jpg', 'mw119042.jpg', 'mw131344.jpg', 'mw131346.jpg', 'mw131349.jpg', 'mw119040.jpg', 'mw131345.jpg', 'mw131347.jpg', 'layout.jpg', 'mw131343.jpg'];Sitter in 12 portraits
Tobias Venner;1600;Medical writer;['mw69576.jpg', 'mw69575.jpg', 'mw122708.jpg'];Sitter in 3 portraits
Edward Lake;1600;Church of England clergyman;['mw137177.jpg', 'mw137176.jpg', 'mw137175.jpg'];Sitter in 3 portraits
John Lake;1600;Bishop of Chichester;['mw140916.jpg', 'mw03598.jpg', 'mw75937.jpg', 'mw140914.jpg', 'mw140915.jpg', 'mw14467.jpg', 'mw14468.jpg', 'mw195847.jpg', 'mw17054.jpg', 'mw01430.jpg', 'layout.jpg', 'mw14463.jpg'];Later Stuart Portraits Catalogue Entry
John Okey;1600;Parliamentary commander and regicide;['mw39768.jpg', 'mw39767.jpg', 'mw132237.jpg', 'mw132236.jpg', 'mw39769.jpg', 'mw132228.jpg', 'mw39770.jpg'];Sitter in 7 portraits
Nicolaus Claudius Fabricius;1600;Magistrate, antiquarian, scholar and patron of arts and science;['mw129545.jpg', 'mw129543.jpg', 'mw129547.jpg'];Sitter in 3 portraits
James Nayler;1600;Quaker preacher and writer;['mw136323.jpg', 'mw136319.jpg', 'mw268462.jpg', 'mw268463.jpg', 'mw268504.jpg', 'mw136320.jpg', 'mw38997.jpg', 'mw136322.jpg', 'mw136316.jpg', 'mw136321.jpg', 'mw42030.jpg'];Sitter associated with 11 portraits
Sir Edward Walpole;1600;Politician, MP for King's Lynn;['mw138244.jpg'];Sitter in 1 portrait
John Gadbury;1600;Astrologer;['mw139069.jpg', 'mw252681.jpg', 'mw145149.jpg', 'mw136208.jpg'];Sitter associated with 4 portraits
Sir Peyton Ventris;1600;Judge and politician;['mw142067.jpg'];Sitter in 1 portrait
Horace Vere, Baron Vere of Tilbury;1600;Soldier;['mw122717.jpg', 'mw129310.jpg', 'mw06493.jpg', 'mw199481.jpg', 'mw261048.jpg', 'mw129309.jpg', 'mw122719.jpg', 'mw261047.jpg'];Sitter in 8 portraits. Considered the greatest professional soldier of his day, Horace Vere was created Master-General of the Ordnance for life in 1623. Among his distinguished campaigns, the defence of Breda in 1624 was particularly notable.
Mary Vere (née Tracy), Lady Vere;1600;Gentlewoman and patron of ministers, former wife of William Hoby, and later wife of Sir Horace Vere;['mw261049.jpg', 'mw133721.jpg', 'mw133723.jpg'];Sitter in 3 portraits
Theodore Haak;1600;German Calvinist scholar;['mw140603.jpg'];Sitter in 1 portrait
John Hacket;1600;Bishop of Lichfield and Coventry;['mw191953.jpg', 'mw117603.jpg', 'mw117605.jpg', 'mw137037.jpg', 'mw117604.jpg', 'mw62208.jpg'];Sitter in 6 portraits
John Oldham;1600;Poet;['mw138613.jpg'];Sitter in 1 portrait
Samuel Fairclough;1600;Nonconformist divine;['mw135604.jpg', 'mw15878.jpg'];Sitter in 2 portraits
Ferdinando Fairfax, 2nd Lord Fairfax of Cameron;1600;Parliamentary general;['mw36046.jpg', 'mw132191.jpg', 'mw132190.jpg', 'mw36050.jpg', 'mw129736.jpg', 'mw36047.jpg'];Sitter in 6 portraits
Thomas Fairfax, 3rd Lord Fairfax of Cameron;1600;Parliamentary Commander-in-Chief;['mw132147.jpg', 'mw118686.jpg', 'mw118690.jpg', 'mw119914.jpg', 'mw132180.jpg', 'mw118691.jpg', 'mw132170.jpg', 'mw135810.jpg', 'mw119894.jpg', 'mw132124.jpg', 'mw02163.jpg', 'mw119868.jpg', 'mw07358.jpg', 'mw132141.jpg', 'mw129713.jpg', 'mw118689.jpg', 'mw132140.jpg', 'mw132126.jpg', 'mw132179.jpg', 'mw02164.jpg'];Sitter associated with 88 portraits. Perhaps the most accomplished Parliamentarian officer, Fairfax was appointed Lord General of the New Model Army after his victory at Marston Moor, 1644. His decisive string of victories, beginning with the battle of Naseby in 1645, won the Civil War for Parliament. Extremism alarmed him and he refused to serve on the court which tried the King or to lead the army into Scotland in 1650. He retired from public life until 1660, when he supported General Monck's march to London to demand a free parliament and was one of those who went to the Hague to greet Charles II before his Restoration to the throne.
Anne (née de Vere), Lady Fairfax;1600;Wife of 3rd Baron Fairfax;['mw36075.jpg', 'mw134484.jpg', 'mw36074.jpg', 'layout.jpg', 'mw120163.jpg'];Sitter in 6 portraits
William Sancroft;1600;Archbishop of Canterbury;['mw140888.jpg', 'mw116237.jpg', 'mw140914.jpg', 'mw116247.jpg', 'mw05606.jpg', 'mw140893.jpg', 'mw14463.jpg', 'mw140916.jpg', 'mw140891.jpg', 'mw03598.jpg', 'mw90986.jpg', 'mw140885.jpg', 'mw90985.jpg', 'mw14468.jpg', 'mw192533.jpg', 'mw01430.jpg', 'mw140915.jpg', 'mw140889.jpg', 'mw14467.jpg', 'mw05605.jpg'];Later Stuart Portraits Catalogue Entry
William Walsh;1600;Poet and critic;['mw143342.jpg', 'mw141767.jpg', 'mw06568.jpg'];Later Stuart Portraits Catalogue Entry
Sir Geoffrey Palmer, 1st Bt;1600;Attorney-General;['mw137971.jpg', 'mw04838.jpg', 'mw129736.jpg', 'mw04839.jpg'];Sitter in 4 portraits
Herbert Palmer;1600;Church of England clergyman and college head;['mw131376.jpg'];Sitter in 1 portrait
Thomas Jacombe;1600;Nonconformist divine;['mw137405.jpg', 'mw137431.jpg', 'mw137416.jpg', 'mw137483.jpg'];Sitter in 4 portraits
Sir Edward Gage, Bt;1600;Nobleman;['mw138254.jpg'];Sitter in 1 portrait
Sir Henry Gage;1600;Soldier, royalist and Governor of Oxford;['mw02379.jpg', 'mw132014.jpg'];Sitter in 2 portraits. Royalist who in the Civil War infused new spirit into the garrison at Oxford. He captured Borestall House, relieved Basing House, and as a reward was knighted and appointed Governor of Oxford.
Sir Edmund Verney;1600;Soldier;['mw131975.jpg', 'mw131976.jpg', 'mw129736.jpg', 'mw07994.jpg'];Sitter in 4 portraits. Although he disapproved of and voted against the policies of Charles I, Verney's personal loyalty to the King was such that he fought for the Royalist side in the Civil War. His family was divided, as his eldest son supported Parliament. Appointed standard-bearer, Verney killed sixteen Parliamentarians at the Battle of Edgehill before meeting his own death. According to legend, his hand was later found still grasping the standard, but his body was never recovered.
Sir Greville Verney;1600;Knight of the Bath;['mw138156.jpg'];Sitter in 1 portrait
William Verney;1600;Son of Sir Greville Verney;['mw138129.jpg', 'mw63957.jpg'];Sitter in 2 portraits
George Vernon;1600;Politician, MP for Derby and builder of Sudbury Hall;['mw118825.jpg'];Sitter in 1 portrait
Anne Oliver;1600;Wife of Peter Oliver;['mw04738.jpg'];Sitter in 1 portrait
Thomas Sanders;1600;Politician and Parliamentarian Colonel;['mw135832.jpg'];Sitter in 1 portrait
Richard Neile;1600;Archbishop of York;['mw292285.jpg'];Sitter associated with 1 portrait
Benjamin Keach;1600;Baptist preacher and writer;['mw64797.jpg', 'mw142032.jpg'];Sitter in 2 portraits
King James II;1600;Reigned 1685-88;['mw74057.jpg', 'mw136443.jpg', 'mw74077.jpg', 'mw136559.jpg', 'mw74069.jpg', 'mw03425.jpg', 'mw03422.jpg', 'mw117873.jpg', 'mw74026.jpg', 'mw117395.jpg', 'mw130001.jpg', 'mw74076.jpg', 'mw00154.jpg', 'mw07531.jpg', 'mw03421.jpg', 'mw118006.jpg', 'mw03423.jpg', 'mw03424.jpg', 'mw03420.jpg', 'mw74035.jpg'];Later Stuart Portraits Catalogue Entry
James Scott, Duke of Monmouth and Buccleuch;1600;Son of Charles II and Lucy Walter;['mw136662.jpg', 'mw04467.jpg', 'mw136670.jpg', 'mw122694.jpg', 'mw136667.jpg', 'mw07690.jpg', 'mw04466.jpg', 'mw136940.jpg', 'mw62825.jpg', 'mw04468.jpg', 'mw192483.jpg', 'mw192484.jpg', 'mw04465.jpg', 'mw62827.jpg', 'mw136494.jpg', 'mw40103.jpg', 'mw199640.jpg', 'mw192478.jpg', 'mw80500.jpg', 'mw63641.jpg'];Sitter associated with 42 portraits. The eldest of Charles II's fourteen illegitimate children, Monmouth was the son of Lucy Walter. He fought in the Second and Third Anglo-Dutch wars gaining a considerable reputation as one of Britain's finest soldiers. Charming and ambitious, he was put forward as a Protestant candidate for the throne at the time of the 'Popish Plot' in 1678. On his father's death in 1685 he led the 'Monmouth Rebellion', an attempt to take the throne from his uncle, James II. He landed in England with a small Protestant army and issued a declaration in which he accused James of poisoning the late king, usurping the throne and ruling against the law. He was defeated at Sedgemoor and was tried and executed.
James Vernon;1600;Secretary of State;['mw06498.jpg', 'mw06499.jpg'];Later Stuart Portraits Catalogue Entry
Thomas Vernon;1600;Law reporter and politician;['mw143919.jpg'];Sitter in 1 portrait
John Lambert;1600;Parliamentary general;['mw135816.jpg', 'mw195868.jpg', 'mw137413.jpg', 'mw135811.jpg', 'mw37763.jpg', 'mw03725.jpg', 'mw40177.jpg', 'mw135813.jpg', 'mw149383.jpg', 'mw279901.jpg', 'mw39336.jpg', 'mw140489.jpg', 'layout.jpg', 'mw03724.jpg', 'mw195861.jpg'];Sitter associated with 16 portraits. A Parliamentarian general and politician, Lambert was second only in power to Cromwell, after the death of Ireton. He displayed great tactical and organisational skill during the civil wars and was a leading figure in attempts to redefine the constitution. Lambert was largely responsible for Oliver Cromwell's acceptance of the Protectorship in 1653. After the Restoration he was imprisoned on Guernsey, and was later moved to Drake's Island in Plymouth Sound, where he remained until his death.
Henry Cary, 1st Viscount Falkland;1600;Lord Deputy of Ireland;['mw36509.jpg', 'mw36510.jpg', 'mw131009.jpg', 'mw131008.jpg', 'mw36508.jpg'];Sitter in 5 portraits
Lucius Cary, 2nd Viscount Falkland;1600;Courtier;['mw114481.jpg', 'mw02168.jpg', 'mw194939.jpg', 'mw85500.jpg', 'mw36078.jpg', 'mw131024.jpg', 'mw131052.jpg', 'mw36076.jpg', 'mw131050.jpg', 'mw131020.jpg', 'mw131054.jpg', 'mw16699.jpg', 'mw131055.jpg', 'mw70501.jpg', 'mw36077.jpg', 'mw73785.jpg', 'mw131048.jpg', 'mw116145.jpg', 'mw116146.jpg', 'mw131053.jpg'];"Sitter associated with 23 portraits. Royalist; killed at the Battle of Newbury; wrote verses and philosophical works."
Robert Sanderson;1600;Bishop of Lincoln;['mw137010.jpg', 'mw146865.jpg', 'mw137011.jpg', 'mw146861.jpg', 'mw137007.jpg', 'mw137006.jpg', 'mw137009.jpg', 'mw137003.jpg', 'mw137058.jpg', 'layout.jpg', 'mw146864.jpg', 'mw146862.jpg', 'mw137008.jpg'];Sitter associated with 14 portraits
Sir William Sanderson;1600;Historian;['mw121893.jpg', 'layout.jpg', 'mw121888.jpg'];Sitter in 4 portraits
Francis Sandford;1600;Herald;['mw05611.jpg'];Sitter in 1 portrait
Thomas Parker, 1st Earl of Macclesfield;1600;Lord Chancellor;['mw02921.jpg', 'mw42263.jpg', 'mw197476.jpg', 'mw143905.jpg', 'mw04100.jpg', 'mw197474.jpg', 'mw197475.jpg', 'mw76878.jpg', 'mw128683.jpg', 'mw143906.jpg'];Later Stuart Portraits Catalogue Entry
