John Churchill, 1st Duke of Marlborough;1600;Soldier and statesman;['mw04214.jpg', 'mw80147.jpg', 'mw143248.jpg', 'mw80560.jpg', 'mw80561.jpg', 'mw07653.jpg', 'mw04215.jpg', 'mw143227.jpg', 'mw143228.jpg', 'mw198410.jpg', 'mw04212.jpg', 'mw80436.jpg', 'mw80559.jpg', 'mw07654.jpg', 'mw04211.jpg', 'mw39564.jpg', 'mw04213.jpg', 'mw39562.jpg', 'mw143224.jpg', 'mw80562.jpg'];Later Stuart Portraits Catalogue Entry
Bulstrode Whitelocke;1600;Diplomat, lawyer and politician, MP for Stafford, Great Marlow, Buckinghamshire, Oxford and Bedford;['mw135796.jpg', 'mw135798.jpg', 'mw06758.jpg', 'mw135795.jpg', 'mw06759.jpg', 'mw135797.jpg', 'mw122924.jpg', 'mw129736.jpg'];Sitter in 8 portraits. A Parliamentarian and writer on history and politics, Whitelocke was Keeper of the Great Seal and Ambassador to Sweden, 1653.
Sir James Whitelocke;1600;Judge;['mw06760.jpg'];Sitter in 1 portrait
Nicholas Hawksmoor;1600;Architect;['mw03004.jpg'];Early Georgian Portraits Catalogue Entry
Michiel Adriaenszoon de Ruyter;1600;Dutch Admiral;['mw140576.jpg', 'mw140578.jpg', 'mw140579.jpg', 'mw140571.jpg', 'mw138087.jpg', 'mw140573.jpg', 'mw140577.jpg'];Sitter in 7 portraits
Francis Radcliffe (Radclyffe), 1st Earl of Derwentwater;1600;English peer and member of the House of Lords;['mw123738.jpg'];Sitter associated with 1 portrait
Mary Radcliffe (née Tudor), Countess of Derwentwater;1600;Illegitimate daughter of Charles II, wife of 2nd Earl of Derwentwater;['mw191959.jpg', 'mw191960.jpg', 'mw139614.jpg'];Sitter in 3 portraits
Jan Lievens;1600;Painter;['mw134149.jpg'];Sitter in 1 portrait. Artist associated with 10 portraits
Hélène Fourment (later Rubens);1600;Second wife of Sir Peter Paul Rubens;['mw257503.jpg'];Sitter associated with 1 portrait
John Robinson;1600;Bishop of London and diplomat;['mw142898.jpg', 'mw201760.jpg'];Sitter in 2 portraits
Catharine Desbouverie (née Lethieullier);1600;Wife of Jacob Desbouverie;['mw79730.jpg', 'mw136441.jpg'];Sitter in 2 portraits
René Descartes;1600;French philosopher and mathematician;['mw135124.jpg', 'mw37875.jpg', 'mw135114.jpg', 'mw135119.jpg', 'mw135125.jpg', 'mw135121.jpg', 'mw135118.jpg', 'mw135123.jpg', 'layout.jpg', 'mw62223.jpg'];Sitter in 10 portraits. . . Watch a film clip on the sitter from the BBC Archive in the Media section below
John Lightfoot;1600;Hebraist and rabbinical scholar;['mw137192.jpg', 'mw62015.jpg', 'mw137188.jpg'];Sitter in 3 portraits
Robert Lilburne;1600;Regicide;['mw39419.jpg', 'mw39420.jpg', 'mw39421.jpg', 'mw138046.jpg'];Sitter in 4 portraits
Edward Fowler;1600;Bishop of Gloucester;['mw36162.jpg', 'mw60792.jpg', 'mw36163.jpg', 'mw36164.jpg', 'mw142913.jpg', 'mw142912.jpg', 'mw142911.jpg', 'layout.jpg'];Sitter in 8 portraits
Sir Cloudesley Shovell;1600;Admiral;['mw143255.jpg', 'mw38504.jpg', 'mw05784.jpg', 'mw205631.jpg', 'mw143256.jpg', 'layout.jpg', 'mw38505.jpg', 'mw143258.jpg'];Later Stuart Portraits Catalogue Entry
Charles Talbot, 1st Duke of Shrewsbury;1600;Politician, Lord High Treasurer and Lord Chamberlain;['mw205366.jpg', 'mw205368.jpg', 'mw05785.jpg', 'mw56540.jpg', 'mw00152.jpg', 'mw35478.jpg', 'mw79777.jpg'];Later Stuart Portraits Catalogue Entry
Anna Maria Talbot (née Brudenell), Countess of Shrewsbury;1600;Notorious beauty, wife of 11th Earl of Shrewsbury;['mw05788.jpg', 'mw139613.jpg', 'mw139612.jpg'];Sitter in 3 portraits
Sir Christopher Turnor;1600;Judge;['mw137976.jpg'];Sitter in 1 portrait
Sir Edmund Turnor;1600;Antiquary;['mw143280.jpg', 'mw137815.jpg', 'mw279298.jpg'];Sitter in 3 portraits
Sir Robert Gordon of Straloch;1600;Antiquarian;['mw136215.jpg'];Sitter in 1 portrait
Albert, Count of Arenberg;1600;Spanish military officer;['mw129481.jpg', 'mw129485.jpg', 'mw129484.jpg'];Sitter in 3 portraits
Archibald Campbell, 1st Duke of Argyll;1600;Scottish politician and Captain and Colonel of the Scots Troop of Horse Guards;['mw41098.jpg', 'mw41099.jpg'];Sitter in 2 portraits
Elizabeth Campbell (née Tollemache), Duchess of Argyll;1600;Wife of 1st Duke of Argyll;['mw59311.jpg', 'mw39806.jpg', 'mw140133.jpg'];Sitter in 3 portraits
Henry de Senneterre;1600;Marshall of France and Governor of Lorraine;['mw135015.jpg'];Sitter in 1 portrait
Marie, Marquise de Sévigné (née de Rabutin-Chantal);1600;Woman of letters;['mw67379.jpg', 'mw38327.jpg', 'mw122505.jpg'];Sitter in 3 portraits
William Lilly;1600;Astrologer;['mw136180.jpg', 'mw136174.jpg', 'mw136179.jpg', 'mw90825.jpg', 'mw136168.jpg'];Sitter in 5 portraits
George Fox;1600;Founder of the Society of Friends;['mw36557.jpg', 'mw36556.jpg', 'mw136330.jpg', 'mw136329.jpg', 'mw136325.jpg', 'mw136324.jpg', 'mw36555.jpg'];Sitter in 7 portraits
Sir Thomas Pilkington;1600;Lord Mayor of London, merchant and politician;['mw42873.jpg', 'mw38155.jpg', 'layout.jpg'];Sitter in 3 portraits
James Beauclerk;1600;Brother of Charles Beauclerk, 1st Duke of St Albans;['mw191940.jpg', 'mw191946.jpg', 'mw90943.jpg', 'mw136967.jpg', 'mw191945.jpg', 'mw136965.jpg', 'mw136968.jpg', 'mw90945.jpg', 'mw136966.jpg', 'mw68438.jpg'];Sitter in 10 portraits
Henry Somerset, 1st Duke of Beaufort;1600;Politician, MP for Wootton Basset and Monmouthsire;['mw75840.jpg', 'mw136881.jpg', 'layout.jpg', 'mw136882.jpg', 'mw133937.jpg', 'mw35096.jpg', 'mw123319.jpg', 'mw278705.jpg', 'mw74431.jpg', 'mw136880.jpg', 'mw136879.jpg'];Sitter in 11 portraits
Mary, Duchess of Beaufort;1600;Horticulturist, wife of 1st Duke of Beaufort, daughter of 1st Baron Capel;['mw00433.jpg', 'mw139437.jpg'];"Sitter in 2 portraits. Mary Capel married Henry Somerset in 1657; he was created the Duke of Beaufort in 1682. In around 1660, Somerset inherited the Badminton estate and embarked on a major building project there. Mary focused her attention on the gardens and by 1678 had started a new fashion by installing conservatories. She also built almshouses and Badminton School. In 1681, the Somersets bought a home in Chelsea, which they remodelled, and Mary once again redesigned the gardens."
Henry Somerset, 2nd Duke of Beaufort;1600;Tory politician;['mw75838.jpg', 'mw00152.jpg', 'mw123320.jpg'];Sitter in 3 portraits
Mary Somerset (née Sackville), Duchess of Beaufort;1600;First wife of 2nd Duke of Beaufort, daughter of Charles Sackville, 6th Earl of Dorset;['mw139453.jpg', 'layout.jpg', 'mw60588.jpg'];Sitter in 3 portraits
Archibald Campbell, 1st Marquess of Argyll;1600;Statesman;['mw91252.jpg', 'mw91286.jpg', 'mw135495.jpg', 'mw41117.jpg', 'mw00175.jpg', 'mw135497.jpg', 'mw91251.jpg', 'mw136940.jpg', 'mw91283.jpg', 'mw135496.jpg', 'mw135491.jpg', 'mw91253.jpg', 'mw41116.jpg'];Sitter in 13 portraits
Archibald Campbell, 9th Earl of Argyll;1600;Statesman;['mw140789.jpg', 'mw00173.jpg', 'mw41100.jpg', 'mw00174.jpg', 'mw114117.jpg', 'layout.jpg', 'mw114119.jpg', 'mw41119.jpg'];Sitter associated with 8 portraits. Campbell was created 9th Earl of Argyll in 1663, following the restoration of the title two years after his father, the Marquess of Argyll, was executed for treason. Although he shared few of his father's political convictions, he too was destined to be executed for treason, after leading an abortive Highland rebellion against James VII in 1685, the Scottish dimension of the rising further south by James, Duke of Monmouth.
Lady Anne (née Mackenzie), Countess of Argyll;1600;Governess to Prince William of Orange, former wife of 1st Earl of Balcarres, and later second wife of 9th Earl of Argyll;['mw00173.jpg'];Sitter in 1 portrait
Samuel de Sorbiere;1600;French philosopher and translator;['mw140600.jpg'];Sitter in 1 portrait
John D'Espagne;1600;French religious minister in London;['mw135741.jpg'];Sitter in 1 portrait
Godfrey d'Estrades, Comte d'Estrades;1600;Soldier and statesman;['mw13000.jpg'];Sitter in 1 portrait
Sir Stephen Fox;1600;Financier;['mw140955.jpg', 'mw56934.jpg', 'mw36169.jpg', 'mw140953.jpg', 'mw197264.jpg', 'mw36170.jpg', 'mw77507.jpg'];Sitter in 7 portraits
John Wilmot, 2nd Earl of Rochester;1600;Poet and libertine;['mw268267.jpg', 'mw05397.jpg', 'mw268275.jpg', 'mw81885.jpg', 'mw268279.jpg', 'mw136915.jpg', 'mw268277.jpg', 'mw268270.jpg', 'mw136919.jpg', 'mw201879.jpg', 'mw136917.jpg'];"Sitter in 11 portraits. A poet and courtier, Rochester's satirical wit and licentiousness alternately fascinated and enraged Charles II, who dismissed him from court at least once a year. He is best known for his amorous lyrics, biting satires and obscene fantasies; fickle patron of poets and dramatists, including Dryden."
Laurence Hyde, 1st Earl of Rochester;1600;Politician, MP for several constituencies and writer;['mw140703.jpg', 'mw05395.jpg', 'mw140707.jpg', 'mw140792.jpg', 'mw05396.jpg', 'mw61772.jpg', 'mw201898.jpg', 'mw140704.jpg', 'mw61545.jpg', 'mw201897.jpg', 'mw140706.jpg', 'layout.jpg', 'mw268285.jpg', 'mw67098.jpg'];Later Stuart Portraits Catalogue Entry
John Hay, 1st Marquess of Tweeddale;1600;Second Earl of Tweeddale and Lord Chancellor of Scotland;['mw141631.jpg', 'mw141633.jpg', 'mw60205.jpg'];Sitter in 3 portraits
George Goring, Baron Goring;1600;Royalist soldier;['mw150780.jpg', 'mw58938.jpg', 'mw131807.jpg', 'mw129736.jpg', 'mw02634.jpg', 'mw131808.jpg'];Sitter in 6 portraits
Francis Beaumont;1600;Dramatist;['mw35161.jpg', 'mw81930.jpg', 'mw133412.jpg', 'mw84632.jpg', 'mw133427.jpg', 'mw123363.jpg', 'mw40875.jpg', 'mw133418.jpg', 'mw35159.jpg', 'mw133411.jpg', 'mw40864.jpg', 'layout.jpg', 'mw35160.jpg'];Sitter associated with 13 portraits. . . More on Francis Beaumont: Shakespeare and his contemporaries book in our Shops
Henry Bennet, 1st Earl of Arlington;1600;Politician, Lord Chamberlain;['mw41299.jpg', 'mw136630.jpg', 'mw136628.jpg', 'mw80774.jpg', 'mw80773.jpg', 'mw80777.jpg', 'mw80776.jpg', 'mw41300.jpg', 'mw136627.jpg', 'mw00179.jpg', 'mw80775.jpg', 'mw136632.jpg', 'mw136629.jpg', 'mw136626.jpg', 'mw80772.jpg', 'mw80770.jpg', 'mw80517.jpg', 'mw136631.jpg', 'mw78545.jpg'];Sitter in 19 portraits. An important politician, Bennet was appointed Secretary of State at the Restoration, and led the opposition to the Earl of Clarendon in the Council. He later became the dominant figure in the so-called 'Cabal' ministry, and was privy to the secret part of the Treaty of Dover, made in 1670 between Charles II and Louis XIV. He was created Earl of Arlington and a Knight of the Garter in 1672, but was unpopular and perceived as a promoter of Catholicism and a schemer. He rapidly fell from prominence after 1674.
Isabella (née de Nassau), Countess of Arlington;1600;Wife of 1st Earl of Arlington;['mw57265.jpg', 'mw139530.jpg', 'mw61106.jpg'];Sitter in 3 portraits. Isabella van Beverweerd or Elizabeth married Henry Bennet, later Earl of Arlington in 1666. Lely's portrait was commissioned to celebrate the marriage. The Countess of Arlington was prominent at the court of Charles II and with her husband was influential in promoting mistresses as tokens of political alliance.
Jean de Thévenot;1600;Traveller, linguist, natural scientist and botanist;['mw122697.jpg', 'mw205495.jpg'];Sitter in 2 portraits
Tregonwell Frampton;1600;Known as 'Father of the turf';['mw02318.jpg', 'mw36172.jpg'];Later Stuart Portraits Catalogue Entry
William Widdrington, 1st Baron Widdrington;1600;Royalist army officer;['mw129736.jpg'];Sitter in 1 portrait
Ambrose Rockwood;1600;Jacobite Conspirator and Brigadier;['mw142582.jpg'];Sitter in 1 portrait
Sir Thomas Twisden, 1st Bt;1600;Judge;['mw38852.jpg', 'mw137970.jpg', 'mw38850.jpg', 'mw38853.jpg'];Sitter in 4 portraits
Joseph Beaumont;1600;Poet and college head;['mw137219.jpg'];Sitter in 1 portrait
Sir Richard Beaumont, 1st Bt;1600;Politician;['mw123378.jpg'];Sitter in 1 portrait
Richard Beaumont;1600;Sheriff of the County of Yorkshire;['mw123382.jpg'];Sitter in 1 portrait
Mary Armine (née Talbot), Lady Armine;1600;Benefactor;['mw139826.jpg', 'mw43466.jpg', 'mw139819.jpg'];Sitter in 3 portraits
Sir John Chardin;1600;Merchant-adventurer and orientalist;['mw01214.jpg', 'mw42877.jpg', 'mw42878.jpg', 'mw42876.jpg', 'mw141056.jpg'];Later Stuart Portraits Catalogue Entry
King Charles I;1600;Reigned 1625-49;['mw136443.jpg', 'mw01219.jpg', 'mw01227.jpg', 'mw128191.jpg', 'mw01217.jpg', 'mw01222.jpg', 'mw09641.jpg', 'mw01225.jpg', 'mw01216.jpg', 'mw01221.jpg', 'mw01220.jpg', 'mw01218.jpg', 'mw01224.jpg', 'mw01223.jpg', 'mw128192.jpg', 'mw128187.jpg', 'mw01228.jpg', 'mw128196.jpg', 'mw128188.jpg', 'mw01226.jpg'];Sitter associated with 335 portraits. The younger, surviving son of James I and Anne of Denmark, Charles became heir to the throne on the death of his brother Henry in 1612. Charles inherited his father's belief in the 'Divine Right of Kings' and became the greatest of all British royal art patrons and collectors. His dismissal of Parliament and personal rule, however, along with his imposition of taxes and attempts to impose religious uniformity led eventually to civil war. He was defeated and tried on the charge that he 'traitorously and maliciously levied war against the present Parliament and the people therein represented', and he was executed outside the Banqueting House, Whitehall, on 30 January 1649.. . More on King Charles I: Tudor & Jacobean Portraits book in our Shops | Monarchs range in our Shops | Kings & Queens range in our Shops | Elizabethan Treasures: Miniatures by Hilliard and Oliver catalogue in our Shops. Watch a film clip on the sitter in the Media section below
King Charles II;1600;Reigned 1660-85;['mw01235.jpg', 'mw01230.jpg', 'mw136443.jpg', 'mw01233.jpg', 'mw01239.jpg', 'mw04940.jpg', 'mw02231.jpg', 'mw129909.jpg', 'mw01231.jpg', 'mw01073.jpg', 'mw07188.jpg', 'mw01238.jpg', 'mw00154.jpg', 'mw01072.jpg', 'mw01232.jpg', 'mw01240.jpg', 'mw07189.jpg', 'mw01236.jpg', 'mw01237.jpg', 'mw09919.jpg'];"Sitter associated with 295 portraits. The eldest son of Charles I, he reacted bravely to the outbreak of civil war in 1642; first saw service aged twelve and when advised to retreat cried 'I fear them not'. He campaigned until sent abroad for safety in 1646. Charles invaded England in 1651, ending in disaster at the Battle of Worcester. Sheltered by Royalists for six weeks, he finally escaped to France. He was restored to the throne in 1660, amid great rejoicing, but with limitations on his powers. He became adept at out-manoeuvring the opposition to his policies, particularly in matters of religion and foreign affairs. His court was notorious for its easy-going morality; the King had fourteen children by various mistresses, but no legitimate heir.. . More on King Charles II: Monarchs range in our Shops | Kings & Queens range in our Shops | Pepys and his Contemporaries book in our Shops. Watch a film clip on the sitter from the BBC Archive in the Media section below"
Charles X, King of Sweden;1600;Reigned 1654-60;['mw134888.jpg'];Sitter in 1 portrait
Prince Charles;1600;First son of Charles I;['mw42421.jpg', 'mw129917.jpg', 'mw129903.jpg', 'mw297300.jpg'];Sitter in 4 portraits
Charles XI, King of Sweden;1600;Reigned 1660-97;['mw140493.jpg', 'mw140485.jpg', 'mw61556.jpg', 'mw140491.jpg', 'mw140490.jpg', 'mw57687.jpg'];Sitter in 6 portraits
Charles Lennox, 1st Duke of Richmond and Lennox;1600;Courtier, son of King Charles II;['mw05329.jpg', 'mw61530.jpg', 'mw80501.jpg', 'mw38292.jpg', 'mw136774.jpg', 'mw141653.jpg', 'mw38294.jpg', 'mw201405.jpg', 'mw136773.jpg', 'mw65853.jpg'];Later Stuart Portraits Catalogue Entry
Algernon Sidney;1600;Republican political theorist and colonel;['mw205853.jpg', 'mw40411.jpg', 'mw135792.jpg', 'mw61517.jpg', 'mw138823.jpg', 'mw136940.jpg', 'mw205852.jpg', 'mw138824.jpg', 'mw138826.jpg', 'layout.jpg', 'mw05804.jpg', 'mw38511.jpg', 'mw138822.jpg'];Sitter in 14 portraits
David Beck;1600;Etcher;['mw134146.jpg'];Sitter in 1 portrait. Artist associated with 1 portrait
Charles Lewis (Louis), Elector Palatine;1600;Second son of Frederick V, Elector Palatine and King of Bohemia and Elizabeth of Bohemia;['mw261271.jpg', 'mw70026.jpg', 'mw43439.jpg', 'mw130091.jpg', 'mw128086.jpg', 'mw130110.jpg', 'mw70023.jpg', 'layout.jpg', 'mw130090.jpg', 'mw130086.jpg', 'mw130079.jpg', 'mw70027.jpg', 'mw130015.jpg', 'mw130076.jpg', 'mw130068.jpg', 'mw191382.jpg', 'mw130069.jpg', 'mw43342.jpg', 'mw130078.jpg', 'mw66230.jpg'];Sitter in 21 portraits
Robert Bertie, 1st Earl of Lindsey;1600;Admiral;['mw131921.jpg', 'mw131896.jpg', 'mw131924.jpg', 'mw131925.jpg', 'mw131911.jpg', 'mw131914.jpg', 'mw131918.jpg', 'mw39427.jpg', 'mw131907.jpg', 'mw75567.jpg', 'mw79779.jpg', 'mw131909.jpg', 'mw131912.jpg', 'mw39428.jpg', 'mw16699.jpg', 'mw196854.jpg', 'mw196850.jpg', 'mw116145.jpg', 'mw116146.jpg', 'mw196852.jpg'];Sitter in 24 portraits
Montague Bertie, 2nd Earl of Lindsey;1600;Royalist soldier, courtier and politician, MP for Lincolnshire and Stamford;['mw82203.jpg', 'mw03924.jpg', 'mw39425.jpg', 'mw196855.jpg', 'mw56951.jpg', 'mw131927.jpg', 'mw118497.jpg', 'mw131919.jpg', 'mw39426.jpg'];Sitter associated with 9 portraits
Sir John Marsham;1600;Antiquary;['mw138741.jpg', 'mw138736.jpg', 'mw40202.jpg', 'mw138738.jpg'];Sitter in 4 portraits
Sir Thomas Roe;1600;Diplomat and politician, MP for Oxford;['mw05402.jpg', 'mw81736.jpg', 'mw133530.jpg', 'layout.jpg', 'mw129736.jpg'];Sitter in 5 portraits
Sir Thomas Tyldesley;1600;Soldier and royalist General;['mw06442.jpg', 'mw41474.jpg', 'mw118823.jpg', 'mw41475.jpg', 'mw135819.jpg'];Sitter associated with 5 portraits
Walter Charleton;1600;Physician;['mw263853.jpg', 'mw36214.jpg', 'mw36215.jpg', 'mw263855.jpg', 'mw138345.jpg'];Sitter in 5 portraits
Walter Charlton;1600;Physician and natural philosopher;['mw135946.jpg', 'mw135970.jpg'];Sitter in 2 portraits
William Cavendish, 1st Duke of Devonshire;1600;Statesman;['mw35895.jpg', 'mw35095.jpg', 'mw141601.jpg', 'mw82063.jpg', 'mw138918.jpg', 'mw141602.jpg', 'mw202649.jpg', 'mw202674.jpg', 'mw79777.jpg', 'mw202675.jpg'];Sitter associated with 10 portraits
Rachel Cavendish (née Russell), Duchess of Devonshire;1600;Wife of 2nd Duke of Devonshire;['mw202492.jpg', 'mw40272.jpg'];Sitter in 2 portraits
Christian Cavendish (née Bruce), Countess of Devonshire;1600;Royalist noblewoman, daughter of Edward Bruce, 1st Baron of Kinloss;['mw134451.jpg'];Sitter in 1 portrait
Elizabeth Cavendish (née Cecil), Countess of Devonshire;1600;Wife of 3rd Earl of Devonshire;['mw149153.jpg', 'mw134450.jpg', 'mw192162.jpg', 'mw18445.jpg', 'mw18873.jpg', 'mw18522.jpg'];Sitter in 6 portraits
John Rogers;1600;Preacher of Dedham, Essex;['mw131439.jpg', 'mw126018.jpg', 'mw126016.jpg', 'mw40560.jpg', 'mw131437.jpg', 'mw40561.jpg'];Sitter in 6 portraits
Richard Talbot, Earl of Tyrconnel;1600;Soldier;['mw140791.jpg', 'mw06450.jpg'];Later Stuart Portraits Catalogue Entry
Thomas Gouge;1600;Nonconformist divine and philanthropist;['mw137481.jpg', 'mw137480.jpg', 'mw254475.jpg', 'mw16335.jpg', 'mw137482.jpg'];Sitter in 5 portraits
William Gouge;1600;Clergyman and author;['mw131360.jpg', 'mw117594.jpg', 'mw131361.jpg', 'mw117593.jpg', 'mw131352.jpg', 'mw115614.jpg'];Sitter in 6 portraits
Robert Charnock;1600;Jacobite Conspirator;['mw142582.jpg'];Sitter in 1 portrait
Stephen Charnock;1600;Nonconformist minister;['mw137411.jpg', 'mw137412.jpg', 'mw137410.jpg'];Sitter in 3 portraits
John Lisle;1600;Regicide;['mw129736.jpg', 'mw37834.jpg'];Sitter in 2 portraits
Timothy Rogers;1600;Presbyterian minister;['mw142026.jpg'];Sitter in 1 portrait
William Russell, 1st Duke of Bedford;1600;Soldier and Privy Counsellor;['mw133955.jpg', 'mw00450.jpg', 'mw133966.jpg', 'mw133941.jpg', 'layout.jpg', 'mw84934.jpg', 'mw123765.jpg', 'mw60674.jpg', 'mw123757.jpg', 'mw133946.jpg', 'mw133973.jpg', 'mw123759.jpg', 'mw00451.jpg', 'mw123753.jpg', 'mw81139.jpg'];Early Stuart Portraits Catalogue Entry
Anne Russell (née Carr), Countess of Bedford;1600;Former wife of William Russell, 5th Earl, and later wife of 1st Duke of Bedford;['mw18532.jpg', 'mw18533.jpg', 'mw134416.jpg', 'mw123774.jpg', 'mw84935.jpg', 'mw18454.jpg', 'mw149151.jpg', 'mw120284.jpg', 'mw74194.jpg', 'layout.jpg'];Sitter associated with 10 portraits
Sir Martin Lister;1600;Farmer and politician, MP for Brackley;['mw132458.jpg', 'mw132480.jpg', 'mw196929.jpg', 'mw129736.jpg', 'mw132464.jpg'];Sitter in 5 portraits
John Playford;1600;Musician and publisher;['mw139330.jpg', 'mw139329.jpg', 'mw139328.jpg', 'mw43251.jpg', 'mw139327.jpg'];Sitter in 5 portraits. Artist associated with 1 portrait
Francis Russell, 4th Earl of Bedford;1600;Politician, commissioned the building of of Covent Garden piazza and the church of St Paul's;['mw133942.jpg', 'mw123750.jpg', 'mw81138.jpg', 'mw133941.jpg', 'mw133944.jpg', 'mw77718.jpg', 'mw133945.jpg', 'mw85491.jpg', 'mw84927.jpg', 'mw123646.jpg', 'mw133943.jpg'];Sitter associated with 11 portraits
Catherine Russell (née Bridges), Countess of Bedford;1600;Wife of 4th Earl of Bedford;['mw84926.jpg'];Sitter associated with 1 portrait
Edmund Arrowsmith;1600;Jesuit;['mw39785.jpg', 'mw131542.jpg'];Sitter in 2 portraits
Henry Heath ('Paul of St Magdalen');1600;Franciscan martyr;['mw16327.jpg', 'mw16694.jpg'];Sitter in 2 portraits
Sir Henry Chauncy;1600;Lawyer and antiquary;['mw142303.jpg', 'mw136948.jpg'];Sitter in 2 portraits
Abraham Simon;1600;Medallist and modeller;['mw40416.jpg', 'mw05812.jpg', 'mw139304.jpg', 'mw61416.jpg', 'layout.jpg'];Sitter in 5 portraits. Artist associated with 2 portraits
Robert Plot;1600;Antiquary;['mw138796.jpg', 'mw81831.jpg'];Sitter in 2 portraits
Henry Sidney, Earl of Romney;1600;Politician and Colonel;['mw138127.jpg', 'mw138121.jpg', 'mw05422.jpg', 'mw64473.jpg', 'mw206688.jpg', 'mw138119.jpg', 'mw59179.jpg', 'mw40248.jpg', 'mw138128.jpg'];Sitter associated with 9 portraits. Youngest son of Robert, 2nd Earl of Leicester. Envoy to The Hague in 1679-1681 Sidney gained the confidence of William of Orange and was instrumental in preparing his arrival in England in 1688. After the accession of William III to the English throne Sidney was rewarded with offices and honours, including the posts of secretary of state (1690-1) and lord-lieutenant of Ireland (1692). He was created Earl of Romney in 1692 and died unmarried in 1704.
Humphrey Gower;1600;College Head;['mw142998.jpg'];Sitter in 1 portrait
William Bedloe;1600;Informer and adventurer;['mw123853.jpg', 'mw123455.jpg', 'mw140270.jpg', 'mw123458.jpg', 'mw123635.jpg', 'mw123465.jpg', 'mw123625.jpg', 'mw123738.jpg', 'mw57674.jpg'];Sitter associated with 9 portraits
Thomas Howard, 14th Earl of Arundel, 4th Earl of Surrey and 1st Earl of Norfolk;1600;Patron of art and collector;['mw130230.jpg', 'mw70856.jpg', 'mw70978.jpg', 'mw130275.jpg', 'mw70977.jpg', 'mw130262.jpg', 'mw70876.jpg', 'mw00194.jpg', 'mw130272.jpg', 'mw70855.jpg', 'mw70853.jpg', 'mw130197.jpg', 'mw128617.jpg', 'mw70878.jpg', 'mw70854.jpg', 'mw130261.jpg', 'mw00193.jpg', 'mw07037.jpg', 'mw71404.jpg', 'mw130254.jpg'];Sitter associated with 68 portraits. Arundel was the most influential connoisseur of his age, and was described as 'one that loved and favoured all arts and artists in great measure and was the bringer of them in to England'. He fostered the careers of Inigo Jones, Daniel Mytens, Wenceslaus Hollar, van Dyck, and Rubens, who called him 'one of the evangelists of art'. Arundel became the major influence on the connoisseurship of the royal family, and on the formation of artistic taste amongst the aristocracy and gentry. He withdrew to a self-imposed exile during the Civil War, but made his Royalist sympathies clear by donating £54,000 to the King's cause.. . More on Thomas Howad, 14th Earl of Arundel: Tudor & Jacobean Portraits book in our Shops
Henry Frederick Howard, 15th Earl of Arundel, 5th Earl of Surrey and 2nd Earl of Norfolk;1600;Royalist soldier and politician, MP for Arundel and Callan;['mw18450.jpg', 'mw130549.jpg', 'mw130886.jpg', 'mw130881.jpg', 'mw208494.jpg', 'mw18528.jpg', 'layout.jpg', 'mw18529.jpg'];Sitter associated with 11 portraits
Blanche Arundell (née Somerset), Lady Arundell of Wardour;1600;Royalist noblewoman;['mw134485.jpg', 'mw35118.jpg'];Sitter in 2 portraits
Sir Robert Heath;1600;Judge;['mw131728.jpg', 'mw43325.jpg'];Sitter in 2 portraits
Sir William Dick;1600;Merchant and financier;['mw132573.jpg'];Sitter in 1 portrait
Edward Littleton, Baron Littleton;1600;Judge, politician and Chief Justice of North Wales;['mw03943.jpg', 'mw80150.jpg', 'mw118499.jpg', 'mw196978.jpg', 'mw131700.jpg', 'mw118501.jpg', 'mw129301.jpg', 'mw140146.jpg', 'mw131717.jpg', 'mw131702.jpg', 'mw131703.jpg', 'mw131719.jpg', 'mw118594.jpg', 'mw131721.jpg'];Sitter in 14 portraits
Thomas Simon;1600;Engraver;['mw136253.jpg'];Sitter in 1 portrait. Artist associated with 24 portraits. Thomas Simon was apprenticed to London goldsmith Edward Greene, who was chief engraver at the Mint. He received a position at the Mint in about 1635 and in 1644 was made joint chief engraver with Edward Wade. Simon became a freeman of the Goldsmiths' Company in 1646. From that time, he produced portrait medals of many of the leading figures of the day. Having executed the great seal of the Commonwealth and dies for the coinage, he was promoted to chief engraver to the Mint and Seals. He produced several fine portrait medals of Oliver Cromwell, one of which is copied from a miniature by Cooper. After the Restoration, Simon was appointed engraver of the King's Seals.
Christopher Simpson (Sympson);1600;Violist and writer on musical theory and practice;['mw121902.jpg', 'mw121899.jpg', 'mw121904.jpg', 'mw121900.jpg', 'mw121903.jpg', 'mw136258.jpg', 'mw136256.jpg', 'mw121897.jpg', 'mw136257.jpg'];Sitter in 9 portraits
Edward Simpson (Simson);1600;Clergyman and historian;['mw131372.jpg', 'mw116390.jpg'];Sitter in 2 portraits
Joseph Martyn;1600;Merchant;['mw198895.jpg', 'mw37911.jpg', 'mw61866.jpg'];Sitter in 3 portraits
