Richard Lovelace;1600;Cavalier and poet;['mw132924.jpg', 'mw132914.jpg', 'mw132910.jpg', 'mw40193.jpg', 'mw132921.jpg'];Sitter in 5 portraits
Sir John Pratt;1600;Lord Chief Justice;['mw05125.jpg'];Later Stuart Portraits Catalogue Entry
George Hickes;1600;Nonjuror and Dean of Worcester;['mw13308.jpg', 'mw140905.jpg'];Sitter in 2 portraits
Charles Hickman;1600;Church of Ireland bishop of Derry;['mw142982.jpg'];Sitter in 1 portrait
Samuel Clarke;1600;Nonconformist divine and religious biographer;['mw35555.jpg', 'mw254545.jpg', 'mw254527.jpg', 'mw254541.jpg', 'mw254526.jpg', 'mw82202.jpg', 'mw254535.jpg', 'mw254543.jpg', 'mw137498.jpg', 'mw254547.jpg', 'mw254542.jpg', 'mw137486.jpg', 'mw137494.jpg', 'mw254534.jpg', 'mw137488.jpg', 'mw137495.jpg', 'mw254580.jpg', 'mw16330.jpg', 'mw137497.jpg', 'mw254540.jpg'];Sitter in 26 portraits
Samuel Clarke;1600;Nonconformist minister and biblical scholar;['mw137501.jpg', 'mw254587.jpg'];Sitter in 2 portraits
Richard Smith;1600;Vicar apostolic of the English church;['mw192541.jpg', 'mw129123.jpg', 'mw129128.jpg'];Sitter associated with 3 portraits
Matthew Meade (Mead);1600;Nonconformist minister of Stepney;['mw137431.jpg', 'mw77944.jpg', 'mw64788.jpg', 'mw137548.jpg'];Sitter in 4 portraits
Sir William Gregory;1600;Judge, Speaker of the House of Commons;['mw117527.jpg'];Sitter associated with 1 portrait
David Clarkson;1600;Divine and controversialist;['mw254603.jpg', 'mw254602.jpg', 'mw16602.jpg'];Sitter in 3 portraits
Edward Cecil, Viscount Wimbledon;1600;Naval and military commander;['mw129306.jpg', 'mw129318.jpg', 'mw06857.jpg', 'mw129308.jpg'];Sitter in 4 portraits. A military and naval commander, and the grandson of the great Elizabethan statesman, Lord Burghley, Wimbledon served under Elizabeth I, James I and Charles I. He eventually came to be regarded as a great military hero, although several of his naval operations against the Spanish in the 1620s were notable failures. He was a knowledgeable patron of the arts and his portrait was painted on a number of occasions by Miereveldt. He was created Viscount Wimbledon in 1626.
Richard Graham, Viscount Preston;1600;Jacobite;['mw08942.jpg'];Sitter associated with 1 portrait
Sir Bevil Grenville;1600;Royalist soldier and politician, MP for Cornwall and Launceston;['mw191510.jpg', 'mw117595.jpg', 'mw131846.jpg', 'mw37033.jpg', 'mw131805.jpg', 'mw131848.jpg', 'mw131843.jpg', 'layout.jpg', 'mw131845.jpg', 'mw16699.jpg', 'mw131844.jpg', 'mw131849.jpg', 'mw131847.jpg', 'mw37032.jpg', 'mw191511.jpg', 'mw116145.jpg', 'mw116146.jpg', 'mw117596.jpg', 'mw131835.jpg'];Sitter in 19 portraits
William Hicks;1600;Puritan;['mw136098.jpg', 'mw37544.jpg', 'mw136106.jpg', 'mw242164.jpg', 'mw136108.jpg', 'mw242163.jpg'];Sitter associated with 6 portraits
Francis Higgins;1600;Archdeacon of Cashel and Prebendary of Christ Church, Dublin;['mw37225.jpg', 'mw37226.jpg'];Sitter in 2 portraits
John Clavel;1600;Reformed Highwayman and author;['mw134808.jpg', 'mw134737.jpg', 'mw134723.jpg'];Sitter in 3 portraits
Robert Douglas, Count Douglas;1600;Army officer in the Swedish service;['mw132329.jpg', 'mw132323.jpg', 'mw149028.jpg', 'mw132321.jpg', 'mw132322.jpg'];Sitter associated with 5 portraits
Richard Lower;1600;Physician and physiologist;['mw138351.jpg'];Sitter associated with 1 portrait
Robert Lowick;1600;Army officer and Jacobite conspirator;['mw142582.jpg'];Sitter in 1 portrait
Thomas Smith;1600;Bishop of Carlisle;['mw40763.jpg', 'mw13389.jpg', 'mw60836.jpg'];Sitter in 3 portraits
John Paulet, 5th Marquess of Winchester;1600;Royalist;['mw42717.jpg', 'mw133895.jpg', 'mw133892.jpg', 'mw42715.jpg', 'mw133891.jpg', 'mw42714.jpg', 'mw42718.jpg', 'mw39185.jpg', 'mw195523.jpg', 'mw133896.jpg', 'mw39184.jpg', 'mw42716.jpg', 'mw133890.jpg'];Sitter in 13 portraits
Anne Finch, Countess of Winchilsea;1600;Poet, wife of 5th Earl of Winchilsea;['mw06861.jpg'];Later Stuart Portraits Catalogue Entry
John Preston;1600;Puritan divine;['mw121175.jpg', 'mw131324.jpg', 'mw131323.jpg', 'mw57782.jpg', 'mw131320.jpg', 'mw121177.jpg', 'mw131325.jpg', 'mw131321.jpg'];Sitter in 8 portraits
William Russell, Lord Russell;1600;Politician, MP for Tavistock and Bedfordshire;['mw61751.jpg', 'mw75147.jpg', 'mw120601.jpg', 'mw136711.jpg', 'mw202487.jpg', 'mw136707.jpg', 'mw40272.jpg', 'mw202492.jpg', 'mw136940.jpg', 'mw76392.jpg', 'mw202489.jpg', 'mw136713.jpg', 'mw05529.jpg', 'mw136705.jpg', 'mw136710.jpg', 'mw202812.jpg', 'mw136704.jpg', 'mw05530.jpg', 'mw202488.jpg', 'mw42454.jpg'];Sitter associated with 28 portraits. Russell was the grandson of the disgraced Earl and Countess of Somerset, who had scandalised the Jacobean Court. He was a Whig politician, known as 'The Patriot', who defended religious nonconformity, a limited monarchy and the right of resistance. He feared that if James, then Duke of York, became king he would overturn parliamentary power with policies promoting France, Catholicism and absolutism. He supported the Exclusion Bill which attempted to remove James from the order of succession. Russell maintained his innocence of involvement in the Rye House Plot but was found guilty of treason and executed.
Nathaniel Highmore;1600;Physician;['mw03132.jpg', 'mw138357.jpg', 'mw138355.jpg'];"Sitter in 3 portraits. Physician; friend of William Hervey, to whom he dedicated his first work, Corporis Humani Disquisitio (Disquisition on the Human Body), 1651; its title-page includes the first illustration of the circulation of blood."
Elizabeth Claypole (née Cromwell);1600;Daughter of Oliver Cromwell;['mw01330.jpg', 'mw136292.jpg', 'mw136291.jpg', 'mw136290.jpg', 'mw136289.jpg', 'mw136314.jpg', 'mw129353.jpg'];Sitter associated with 7 portraits. The second daughter of Oliver Cromwell, and his favourite child, Elizabeth Claypole is supposed to have exercised a moderating influence on him. She married John Claypole, a leading Parliamentarian in 1646.
John Claypole;1600;Parliamentarian, husband of Cromwell's daughter, Elizabeth;['mw01331.jpg', 'mw135907.jpg', 'mw136314.jpg'];Sitter in 3 portraits
Sir Francis Windebank;1600;Secretary of State;['mw35304.jpg', 'mw131583.jpg', 'mw131587.jpg', 'mw131584.jpg'];Sitter in 4 portraits
John Russell;1600;Soldier, brother of 1st Duke of Bedford;['mw138057.jpg', 'mw138059.jpg'];Sitter in 2 portraits
Nehemiah Grew;1600;Physician and botanist;['mw37041.jpg', 'mw142164.jpg', 'mw149406.jpg', 'mw191537.jpg', 'mw42361.jpg'];Sitter in 5 portraits
Ralph Grey, 2nd Baron Grey of Warke;1600;Son of 1st Baron Grey of Warke;['mw59190.jpg', 'mw74195.jpg', 'mw40906.jpg', 'mw136714.jpg'];Sitter associated with 4 portraits. Opinions about the sitter's identity are divided. It may represent Ralph Grey (1630-1675) who succeeded his father as 2nd Baron Grey of Warke in 1674. Chaloner Smith suggests it more probably represents his son Forde Grey (1655-1701) who was Lord Grey at the time the plate was engraved. A Protestant Whig, Forde Grey was implicated in the Rye House Plot. He succeeded his father in 1675 as 3rd Baron Grey, and was created Earl of Tankerville (1695) and rewarded with several high offices by William III. He died in 1701.
Catherine Grey (née Ford), Lady Grey of Warke;1600;Daughter of Sir Edward Ford, wife of Ralph Grey, 2nd Baron Grey of Warke;['mw37044.jpg', 'mw37045.jpg', 'mw59288.jpg', 'mw61153.jpg', 'mw139800.jpg', 'mw139798.jpg', 'mw139799.jpg', 'mw139801.jpg'];Sitter in 8 portraits
Thomas Grey, Baron Grey of Groby;1600;Parliamentarian army commander-in-chief, regicide and politician, MP for Leicester;['mw129736.jpg'];Sitter in 1 portrait
Slingsby Bethel;1600;Republican;['mw138206.jpg', 'mw40514.jpg'];Sitter in 2 portraits
Thomas Hilder;1600;Puritan divine;['mw135697.jpg', 'mw135700.jpg'];Sitter in 2 portraits
Mark Hildesley;1600;Barrister of Lincoln's Inn;['mw140971.jpg', 'mw138272.jpg'];Sitter associated with 2 portraits
Sir Robert Clayton;1600;Lord Mayor of London;['mw144243.jpg', 'mw138158.jpg', 'mw144244.jpg', 'layout.jpg', 'mw60787.jpg'];Sitter in 5 portraits
Sir William Pope, 1st Earl of Downe;1600;Landowner;['layout.jpg', 'mw128716.jpg'];Sitter in 2 portraits
Sir John Lowther, 2nd Bt;1600;Baronet of Whitehaven, Commissioner of the Admiralty and politician, MP for Cumberland;['mw59312.jpg', 'mw64466.jpg', 'mw138135.jpg', 'mw64465.jpg', 'mw138134.jpg', 'mw39473.jpg'];Sitter in 6 portraits. Lived in Lowther, Westmorland. MP for Cumberland and a large landowner. He improved prosperity in the county by developing coal mines and the port of Whitehaven. He served as an Admiralty Commissioner 1689-96.
Vincent Wing;1600;Astronomer;['mw138769.jpg'];Sitter in 1 portrait
Robert Price;1600;Judge;['mw13305.jpg', 'mw204365.jpg', 'mw143908.jpg'];Sitter in 3 portraits
Richard Russell;1600;Diplomat and Roman Catholic bishop in Portugal;['mw137640.jpg', 'mw137639.jpg'];Sitter in 2 portraits
Gabriel Bethlen;1600;Prince of Transylvania and King-elect of Hungary;['mw77544.jpg'];Sitter associated with 1 portrait
Thomas Betterton;1600;Actor and dramatist;['mw77694.jpg', 'mw77696.jpg', 'mw00546.jpg', 'mw81784.jpg', 'mw77697.jpg', 'mw141127.jpg', 'mw141126.jpg', 'mw77699.jpg', 'mw77695.jpg'];Later Stuart Portraits Catalogue Entry
John Drummond, 1st Earl of and titular Duke of Melfort;1600;Secretary of State for Scotland and Jacobite;['mw140880.jpg', 'mw61470.jpg', 'mw140785.jpg', 'mw39603.jpg'];Sitter in 4 portraits
Charles FitzRoy, Duke of Cleveland;1600;Illegitimate son of Charles II;['mw84914.jpg', 'mw01336.jpg'];"Sitter associated with 2 portraits. Charles Fitzroy was the illegitimate eldest son of Barbara Palmer, Countess of Castlemaine and King Charles II. His birth marked the separation of his parents; Lord Castlemaine, his nominal father, a Roman Catholic, had him christened into the Roman Catholic faith, but six days later the King had him re-christened into the Church of England. In 1670 he was created Duke of Southampton and upon the death of his mother in 1709 he became 2nd Duke of Cleveland. He was able to inherit this title even though he was illegitimate through a special proviso included by his father when the Dukedom was created."
Barbara Palmer (née Villiers), Duchess of Cleveland;1600;Mistress of Charles II;['mw65863.jpg', 'mw35607.jpg', 'mw07219.jpg', 'mw113111.jpg', 'mw01336.jpg', 'mw290213.jpg', 'mw84914.jpg', 'mw35606.jpg', 'mw01337.jpg', 'mw290214.jpg', 'mw59077.jpg', 'mw35604.jpg', 'mw139420.jpg', 'mw60037.jpg', 'mw116136.jpg', 'mw01338.jpg', 'mw82051.jpg', 'mw35605.jpg', 'mw139417.jpg', 'mw70392.jpg'];Sitter in 35 portraits. The favourite mistress of Charles II during the 1660s, Barbara Villiers was a dominant presence both at court and in the public's imagination. She married Roger Palmer, later the Earl of Castlemaine, in 1659, and met Charles soon after. She was appointed Lady of the Bedchamber to the Queen in spite of the latter's protests. Regarded as the foremost beauty of her day, she acquired great wealth and had at least five children with the King. She became a Catholic in 1663, dabbled in politics, and was implicated in the fall of Clarendon. She was made a Duchess in her own right in 1670, when her influence with the King was beginning to wane.. . More on Barbara Palmer, Duchess of Cleveland: Pepys and his Contemporaries book in our Shops
Sir Charles Lucas;1600;Soldier and royalist commander;['mw132369.jpg', 'mw16699.jpg', 'mw132349.jpg', 'mw116145.jpg', 'mw132365.jpg', 'mw123963.jpg', 'mw132416.jpg', 'mw116146.jpg', 'mw132361.jpg', 'mw132348.jpg', 'mw132366.jpg', 'layout.jpg', 'mw131293.jpg'];Sitter associated with 13 portraits
Sir Francis Winnington;1600;Lawyer;['mw06874.jpg'];Later Stuart Portraits Catalogue Entry
Humphrey Prideaux;1600;Orientalist;['mw39442.jpg', 'mw142990.jpg'];Sitter in 2 portraits
John Prideaux;1600;Bishop of Worcester;['mw131188.jpg', 'mw131189.jpg', 'mw131187.jpg', 'mw121173.jpg'];Sitter in 4 portraits
Catherine Manners (née Noel), Duchess of Rutland;1600;Third wife of 1st Duke of Rutland, daughter of 3rd Viscount Campden;['layout.jpg', 'mw142402.jpg', 'mw59537.jpg', 'mw40281.jpg'];Sitter in 4 portraits
Katherine Manners (née Russell), Duchess of Rutland;1600;Wife of John Manners, 2nd Duke of Rutland;['mw202492.jpg', 'mw40272.jpg'];Sitter in 2 portraits
John Cleveland;1600;Cavalier poet;['mw132841.jpg', 'mw144453.jpg', 'mw132844.jpg', 'mw42735.jpg', 'mw243708.jpg', 'mw243709.jpg', 'mw80465.jpg', 'mw132851.jpg', 'mw132848.jpg', 'mw243703.jpg', 'mw243704.jpg', 'mw132852.jpg'];Sitter associated with 12 portraits
Francis Manners, 6th Earl of Rutland;1600;Statesman;['mw40278.jpg', 'mw128604.jpg', 'mw128606.jpg', 'mw40277.jpg', 'mw128603.jpg', 'mw128605.jpg', 'mw40280.jpg', 'layout.jpg'];Sitter in 8 portraits
Lord George Manners, 7th Earl of Rutland;1600;Landowner and politician, MP for Grantham and Lincolnshire;['mw84219.jpg'];Sitter associated with 1 portrait
William Beveridge;1600;Bishop of St Asaph;['mw142928.jpg', 'mw142935.jpg', 'mw142936.jpg', 'mw142931.jpg', 'mw142934.jpg', 'mw142933.jpg', 'mw142925.jpg', 'mw14249.jpg', 'layout.jpg'];Sitter in 9 portraits
Hadriaan (Adrian) Beverland;1600;Humanist scholar;['mw60577.jpg', 'mw41032.jpg', 'mw81700.jpg', 'mw125571.jpg', 'mw35306.jpg', 'mw125570.jpg', 'mw41252.jpg', 'mw125574.jpg'];Sitter in 8 portraits
Roger Hill;1600;Lawyer and politician, MP for Bridport;['mw129736.jpg'];Sitter in 1 portrait
Thomas Clifford, 1st Baron Clifford of Chudleigh;1600;Statesman;['mw81966.jpg', 'mw144642.jpg', 'mw136697.jpg', 'mw144641.jpg', 'mw01340.jpg', 'mw136698.jpg', 'mw144640.jpg'];Sitter in 7 portraits. Clifford was the most resolute member of the Cabal ministry, pursuing a steady pro-French policy. He signed the secret part of the Treaty of Dover - accepting a subsidy from France in exchange for the conversion of England to Catholicism - in 1670, and was created Baron and appointed Lord Treasurer in 1672. As a Catholic, he was barred from office by the Test Act (1673), and he died shortly afterwards.. . Watch a film clip on the sitter from the BBC Archive in the Media section below
Samuel Drake;1600;Church of England clergyman;['mw117543.jpg', 'mw117536.jpg', 'mw117539.jpg', 'mw137248.jpg'];Sitter in 4 portraits
Matthew Prior;1600;Poet, Ambassador to France and politician, MP for East Grinstead and Chief Secretary for Ireland;['mw142238.jpg', 'mw05150.jpg', 'mw142180.jpg', 'mw204396.jpg', 'mw142240.jpg', 'mw204397.jpg', 'mw77937.jpg', 'mw05151.jpg', 'mw79953.jpg', 'mw67103.jpg', 'mw38231.jpg', 'mw38229.jpg', 'mw80125.jpg', 'mw05152.jpg', 'mw204402.jpg', 'mw142237.jpg', 'mw79385.jpg', 'mw142241.jpg', 'mw05149.jpg', 'mw204404.jpg'];Later Stuart Portraits Catalogue Entry
Dorothea Rutter;1600;Wife of Michael Rutter of Bourton-on-the-Hill;['mw35222.jpg', 'mw35112.jpg'];Sitter in 2 portraits
Cornelis Drebbel;1600;Philosopher and scientific inventor;['mw57508.jpg'];Sitter in 1 portrait
Hiob Ludolf (Job Leutholf);1600;German Orientalist;['mw140601.jpg'];Sitter in 1 portrait
Sir John Mennes;1600;Admiral;['mw135818.jpg', 'mw04375.jpg', 'mw85454.jpg', 'mw135817.jpg'];Sitter associated with 4 portraits. . . More on Sir John Mennes: Pepys and his Contemporaries book in our Shops
Sir James Wishart;1600;Admiral and politician, MP for Portsmouth;['mw39202.jpg'];Sitter in 1 portrait
Willem Wissing;1600;Portrait painter;['mw59533.jpg', 'mw139211.jpg', 'mw39203.jpg'];"Sitter in 3 portraits. Artist associated with 146 portraits. William Wissing was a Dutch portrait artist. He studied at The Hague under Willem Doudijns and Arnold Van Ravestyn. By 1676, Wissing had settled in England, where he worked as assistant to Sir Peter Lely. After Lely's death in 1680, he established a successful independent career, becoming one of the leading portraitists of his day. Wissing's royal sitters include Charles II, Queen Catharine of Braganza, Prince George of Denmark and James Scott, 1st Duke of Monmouth. His works were widely reproduced; the vast majority, made by engravers including John Smith, Isaac Beckett, and R. Williams, were published by Edward Cooper."
George Wither (Withers);1600;Poet and pamphleteer;['mw57840.jpg', 'mw133469.jpg'];Sitter in 2 portraits
Sir Paul Rycaut;1600;Diplomat and writer;['mw228864.jpg', 'mw138732.jpg', 'mw141057.jpg', 'mw138733.jpg', 'mw138734.jpg', 'mw138735.jpg', 'mw05554.jpg', 'mw05553.jpg'];Early Stuart Portraits Catalogue Entry
Sir Harbottle Grimston, 2nd Bt;1600;Speaker of the House of Commons;['mw117521.jpg', 'mw02763.jpg'];Sitter in 2 portraits
Mary Grimston;1600;Daughter of Sir Samuel Grimston, Bt;['mw36747.jpg', 'mw36748.jpg', 'mw191645.jpg'];Sitter in 3 portraits
John Hilton;1600;Organist and composer;['mw134272.jpg'];Sitter in 1 portrait
John Somers, Baron Somers;1600;Lord Chancellor;['mw16146.jpg', 'mw206787.jpg', 'mw141599.jpg', 'mw13886.jpg', 'mw137910.jpg', 'mw79777.jpg', 'mw14469.jpg', 'mw38539.jpg', 'mw141732.jpg', 'mw141600.jpg', 'mw70073.jpg', 'mw05891.jpg', 'mw255699.jpg', 'mw05892.jpg', 'mw140961.jpg', 'mw05890.jpg', 'mw60798.jpg', 'mw206795.jpg', 'mw56540.jpg', 'mw140962.jpg'];Later Stuart Portraits Catalogue Entry
William Seymour, 2nd Duke of Somerset;1600;Royalist commander and politician, MP for Marlborough;['mw133901.jpg', 'mw133899.jpg', 'mw05894.jpg', 'mw262426.jpg', 'mw133897.jpg', 'mw270568.jpg', 'mw270574.jpg', 'mw270567.jpg', 'mw133917.jpg', 'mw38559.jpg', 'mw270573.jpg', 'mw193477.jpg', 'mw133900.jpg', 'mw133902.jpg', 'mw133890.jpg'];Sitter associated with 15 portraits
Elizabeth Seymour (née Percy), Duchess of Somerset;1600;Heiress, former wife of Henry Cavendish, Earl of Ogle and of Thomas Thynne, and later wife of 6th Duke of Somerset;['mw05896.jpg', 'mw206857.jpg', 'mw59176.jpg', 'mw13880.jpg', 'mw38542.jpg', 'layout.jpg', 'mw13881.jpg'];Later Stuart Portraits Catalogue Entry
Thomas Rymer;1600;Author and antiquary;['mw40282.jpg'];Sitter in 1 portrait
Bruno Ryves;1600;Dean of Windsor;['layout.jpg', 'mw137186.jpg', 'mw38414.jpg'];Sitter in 4 portraits
John Bigg;1600;The Dinton Hermit;['mw142589.jpg'];Sitter in 1 portrait
Robert Carr, Earl of Somerset;1600;Favourite of James I;['mw128583.jpg', 'mw41595.jpg', 'mw80669.jpg', 'mw114349.jpg', 'mw128578.jpg', 'mw128579.jpg', 'mw115265.jpg', 'mw05898.jpg', 'mw128581.jpg', 'mw128580.jpg', 'mw05899.jpg', 'mw206819.jpg', 'mw206817.jpg', 'mw35454.jpg', 'mw114348.jpg', 'mw128576.jpg', 'mw128582.jpg', 'mw76322.jpg', 'mw113615.jpg'];Sitter associated with 19 portraits. Following a fall from his horse at the accession day tilt in March 1607, Robert Carr was nursed by King James I and rapidly became a royal favourite. Created Earl of Somerset in 1616, three years later he was indicted with his wife, Frances Howard, for the murder of his Sir Thomas Overbury. Though Howard confessed, both were later released.. . More on Robert Carr, Earl of Somerset: Tudor & Jacobean Portraits book in our Shops
Frances, Countess of Somerset;1600;Famous beauty;['mw128579.jpg', 'mw119945.jpg', 'mw128580.jpg', 'mw236688.jpg', 'mw80669.jpg', 'mw40785.jpg', 'mw115265.jpg', 'mw133678.jpg', 'mw113615.jpg', 'mw133676.jpg', 'mw133685.jpg', 'mw133675.jpg', 'mw133677.jpg', 'mw133679.jpg', 'mw35454.jpg', 'mw05900.jpg', 'mw113253.jpg', 'mw128576.jpg'];Sitter associated with 18 portraits. A famous beauty, Frances Howard was divorced from Robert Devereux, 3rd Earl of Essex in 1613 and married Robert Carr, Earl of Somerset, a favourite of James I. In 1615 she and her second husband, along with several accomplices, were convicted of poisoning Sir Thomas Overbury, who had opposed their marriage. Although the couple were imprisoned until 1621, they were later pardoned of their crime. History, and their contemporaries, judged Frances more harshly than her husband. It was said of Somerset: 'If he had not met with such a woman he might have been a good man'.. . More on Frances, Countess of Somerset: Tudor & Jacobean Portraits book in our Shops
Edward Progers;1600;Groom of the bedchamber to Charles II;['layout.jpg', 'mw39952.jpg'];Sitter in 2 portraits
Huigh De Groot (Hugo Grotius);1600;Dutch scholar;['mw129505.jpg', 'mw129500.jpg', 'mw81253.jpg', 'mw114176.jpg', 'mw129501.jpg', 'mw129498.jpg', 'mw129503.jpg', 'mw129507.jpg', 'mw129506.jpg', 'mw223439.jpg', 'mw129499.jpg', 'mw129502.jpg', 'mw129504.jpg'];Sitter in 13 portraits
Anne Bill;1600;Printer to King James I, Wife of John Bill;['mw133754.jpg', 'mw133744.jpg', 'mw133748.jpg', 'mw133750.jpg', 'mw133749.jpg', 'mw133753.jpg', 'mw133755.jpg', 'mw133756.jpg'];Sitter in 8 portraits
William Wollaston;1600;Philosopher;['mw91097.jpg', 'mw39221.jpg', 'mw39194.jpg', 'mw39223.jpg', 'mw40175.jpg', 'mw39222.jpg', 'mw131253.jpg', 'layout.jpg'];Sitter in 9 portraits
William Prynne;1600;Puritan pamphleteer;['mw131778.jpg', 'mw39955.jpg', 'mw131773.jpg', 'mw232423.jpg', 'mw38235.jpg', 'mw131774.jpg', 'mw05165.jpg', 'layout.jpg', 'mw131771.jpg', 'mw81281.jpg'];Sitter associated with 10 portraits
Martin Billingsley;1600;Writing Master;['mw133615.jpg', 'mw133616.jpg', 'mw133612.jpg', 'mw133613.jpg'];Sitter in 4 portraits
Philipp Clüver;1600;German geographer and historian;['mw129519.jpg', 'mw129522.jpg', 'mw129521.jpg'];Sitter in 3 portraits
William Drummond of Hawthornden;1600;Poet;['mw133035.jpg', 'mw192902.jpg', 'mw192901.jpg', 'mw35949.jpg', 'mw40033.jpg', 'mw01947.jpg', 'mw133036.jpg', 'mw196499.jpg', 'mw192965.jpg', 'mw192847.jpg', 'mw133034.jpg'];Sitter associated with 11 portraits. William Drummond was the first notable poet in Scotland to write in English. Drummond studied at Edinburgh and spent a few years in France, ostensibly studying law at Bourges and Paris. On the death of his father, he moved to his Hawthornden estate, leaving law for literature and devoting himself to the life of a cultured man of means. Drummond adapted and translated poems from French, Italian, and Spanish, in addition to borrowing from such English poets as Sir Philip Sidney.
John Dryden;1600;Dramatist and Poet Laureate;['mw138483.jpg', 'mw193136.jpg', 'mw226613.jpg', 'mw80085.jpg', 'mw228374.jpg', 'mw228431.jpg', 'mw228436.jpg', 'mw01952.jpg', 'mw82079.jpg', 'mw228427.jpg', 'mw227919.jpg', 'mw228418.jpg', 'mw35953.jpg', 'mw79151.jpg', 'mw01954.jpg', 'mw35954.jpg', 'mw01953.jpg', 'mw141000.jpg', 'mw35950.jpg', 'mw228424.jpg'];Later Stuart Portraits Catalogue Entry
Sir Edward Lutwyche;1600;Judge and politician;['mw142066.jpg'];Sitter in 1 portrait
William Somner;1600;Antiquary and Anglo-Saxon scholar;['mw42866.jpg', 'mw133087.jpg'];Sitter in 2 portraits
Princess Sophia;1600;Daughter of James I;['mw191382.jpg', 'layout.jpg', 'mw43342.jpg', 'mw128086.jpg'];Sitter in 5 portraits
Princess Sophia, Electress of Hanover;1600;Mother of George I, granddaughter of James I;['mw13189.jpg', 'mw16167.jpg', 'mw05913.jpg', 'mw60799.jpg', 'mw142726.jpg', 'mw142729.jpg', 'mw142738.jpg', 'mw13190.jpg', 'mw208670.jpg', 'layout.jpg'];Sitter in 11 portraits. Granddaughter of James I and youngest child of Elizabeth of Bohemia, Sophia was brought up at Leiden before moving to her mother's court at The Hague in 1641. She was tutored in mathematics, law, theology, history and six languages. Her prolific correspondence, written in both French and German, provides a detailed account of court life. In 1658 she married Ernest Augustus, and she eventually became the mother of seven children. As the nearest Protestant claimant to the British throne after Queen Anne, her eldest son became George I.
Sophia Dorothea of Celle;1600;Wife of George I;['mw61415.jpg', 'mw13188.jpg', 'mw143600.jpg'];Sitter in 3 portraits
Hugh Grove;1600;Beheaded Royalist General;['mw132016.jpg'];Sitter in 1 portrait
Thomas Lye (Lee, Leigh);1600;Nonconformist minister;['mw137431.jpg', 'mw137416.jpg', 'mw137483.jpg'];Sitter in 3 portraits
Sir George Mertins;1600;Lord Mayor of London;['mw37886.jpg'];Sitter in 1 portrait
Anthony Wood;1600;Antiquary and historian;['mw42868.jpg', 'mw35777.jpg'];Sitter in 2 portraits. . . Watch a film clip on the sitter from the BBC Archive in the Media section below
Josiah Pullen;1600;Vice-Principal of Magdalen Hall, Oxford;['mw38209.jpg'];Sitter in 1 portrait
Sir Giovanni Francesco Biondi;1600;Diplomat and romance writer;['mw43055.jpg', 'mw133539.jpg'];Sitter in 2 portraits
Alice Dudley (née Leigh), Duchess Dudley;1600;Second wife of Sir Robert Dudley;['mw143234.jpg'];Sitter in 1 portrait
Robert South;1600;Church of England clergyman and theologian;['mw141782.jpg', 'mw268066.jpg', 'mw254459.jpg', 'mw254429.jpg', 'mw268065.jpg', 'mw141783.jpg', 'mw254463.jpg', 'mw254469.jpg'];Sitter in 8 portraits
John Methuen;1600;Diplomat;['mw199243.jpg', 'mw143273.jpg'];Sitter in 2 portraits
Henry Purcell;1600;Composer;['mw66549.jpg', 'mw39572.jpg', 'mw139326.jpg', 'mw05170.jpg', 'mw05171.jpg', 'mw139325.jpg', 'mw38237.jpg', 'mw204802.jpg', 'mw131681.jpg', 'mw204801.jpg', 'mw05172.jpg'];Later Stuart Portraits Catalogue Entry
Sir Robert Dudley;1600;Mariner and landowner;['mw04791.jpg', 'mw119700.jpg'];Sitter associated with 2 portraits. . . More on Sir Robert Dudley: Shakespeare and his contemporaries book in our Shops
Sir Patrick Lyon of Carse;1600;Judge;['mw91524.jpg', 'mw138029.jpg', 'mw138028.jpg'];Sitter in 3 portraits
Thomas Wriothesley, 4th Earl of Southampton;1600;Lord High Treasurer;['mw136597.jpg', 'mw207008.jpg', 'mw05922.jpg', 'mw136594.jpg', 'mw268068.jpg', 'mw136595.jpg', 'mw81690.jpg', 'mw136596.jpg', 'mw207007.jpg', 'mw268067.jpg', 'mw05921.jpg', 'mw85488.jpg'];Sitter associated with 12 portraits. Lord High Treasurer, 1660-7 and son of Shakespeare's patron. Pepys knew Wriothesley well and found him a 'very ready man' and 'brave servant to the king' but with usual attention to detail Pepys complained of his habit of wearing his fingernails too long.
Rachel Wriothesley (née de Massüe), Countess of Southampton;1600;First wife of 4th Earl of Southampton;['mw134408.jpg', 'mw207021.jpg', 'mw134415.jpg'];Sitter in 3 portraits
